{
  "schema_version": "1.0.0",
  "experiment_id": "lobster-aapl-sample-pipeline-v1",
  "random_seed": 7,
  "dataset": {
    "provider": "LOBSTER",
    "dataset_id": "AAPL-2012-06-21-level-5-sample",
    "sha256": "a985e2d3cb1e14abf10f9b8a60177d7fdcf7244574a3cc137c312e00cca1ecce",
    "schema_version": "1.0.0",
    "book_level": "L2",
    "venue": "NASDAQ",
    "symbol": "AAPL",
    "tick_size": 0.01,
    "timezone": "UTC"
  },
  "periods": {
    "train": {"start": "2012-06-21T13:30:00Z", "end": "2012-06-21T17:24:00Z"},
    "validation": {"start": "2012-06-21T17:24:01Z", "end": "2012-06-21T18:42:00Z"},
    "test": {"start": "2012-06-21T18:42:01Z", "end": "2012-06-21T20:00:01Z"}
  },
  "strategies": [
    "fixed_spread",
    "avellaneda_stoikov",
    "queue_aware",
    "toxicity_aware",
    "latency_aware"
  ],
  "sensitivity": {
    "latency_ns": [0, 1000000, 5000000],
    "queue_ahead_fraction": [0.0, 0.5, 1.0],
    "fee_multiplier": [1.0, 1.5]
  },
  "cost_model": {
    "maker_fee_bps": -0.2,
    "taker_fee_bps": 0.3,
    "fixed_fee_per_order": 0.0
  },
  "execution": {
    "order_size": 10.0,
    "inventory_limit": 100.0,
    "quote_interval_ns": 100000000,
    "toxicity_window": 100,
    "volatility_window": 100,
    "adverse_horizon_ns": 1000000000,
    "record_every": 100
  },
  "strategy_parameters": {
    "fixed_half_spread_ticks": 0.5,
    "avellaneda_risk_aversion": 0.05,
    "avellaneda_liquidity": 100.0,
    "avellaneda_horizon": 1.0,
    "inventory_skew_ticks": 0.25,
    "toxicity_threshold": 0.15,
    "max_toxicity_widen_ticks": 2.0
  },
  "evaluation": {
    "embargo_ns": 1000000000,
    "bootstrap_replicates": 500,
    "bootstrap_block_size": 20
  }
}
